{
  "contractId": "CCOQM6S7ICIUWA225O5PSJWUBEMXGFSSW2PQFO6FP4DQEKMS5DASRGRR",
  "description": "Blend emitter contract: the BLND emission source distributing rewards to backstop depositors on Stellar mainnet.",
  "events": [],
  "functions": [
    {
      "name": "initialize",
      "params": [
        { "name": "blnd_token", "type": "address" },
        { "name": "backstop", "type": "address" },
        { "name": "backstop_token", "type": "address" }
      ],
      "returns": "void"
    },
    { "name": "distribute", "params": [], "returns": "i128" },
    {
      "name": "get_last_distro",
      "params": [{ "name": "backstop_id", "type": "address" }],
      "returns": "u64"
    },
    { "name": "get_backstop", "params": [], "returns": "address" },
    {
      "name": "queue_swap_backstop",
      "params": [
        { "name": "new_backstop", "type": "address" },
        { "name": "new_backstop_token", "type": "address" }
      ],
      "returns": "void"
    },
    {
      "name": "get_queued_swap",
      "params": [],
      "returns": { "inner": { "name": "Swap", "type": "named" }, "type": "option" }
    },
    { "name": "cancel_swap_backstop", "params": [], "returns": "void" },
    { "name": "swap_backstop", "params": [], "returns": "void" },
    {
      "name": "drop",
      "params": [
        {
          "name": "list",
          "type": { "item": { "elements": ["address", "i128"], "type": "tuple" }, "type": "vec" }
        }
      ],
      "returns": "void"
    }
  ],
  "name": "Blend Emitter",
  "network": "mainnet",
  "types": {
    "EmitterDataKey": {
      "cases": [
        { "fields": [{ "name": "_0", "type": "address" }], "name": "LastDistro" },
        { "fields": [{ "name": "_0", "type": "address" }], "name": "Dropped" }
      ],
      "kind": "union",
      "name": "EmitterDataKey"
    },
    "EmitterError": {
      "doc": "Error codes for the emitter contract. Common errors are codes that match up with the built-in\ncontracts error reporting. Emitter specific errors start at 1100.",
      "kind": "enum",
      "name": "EmitterError",
      "variants": [
        { "discriminant": 1, "name": "InternalError" },
        { "discriminant": 3, "name": "AlreadyInitializedError" },
        { "discriminant": 4, "name": "UnauthorizedError" },
        { "discriminant": 1100, "name": "InsufficientBackstopSize" },
        { "discriminant": 1101, "name": "BadDrop" },
        { "discriminant": 1102, "name": "SwapNotQueued" },
        { "discriminant": 1103, "name": "SwapAlreadyExists" },
        { "discriminant": 1104, "name": "SwapNotUnlocked" },
        { "discriminant": 1105, "name": "SwapCannotBeCanceled" }
      ]
    },
    "Swap": {
      "fields": [
        { "name": "new_backstop", "type": "address" },
        { "name": "new_backstop_token", "type": "address" },
        { "name": "unlock_time", "type": "u64" }
      ],
      "kind": "struct",
      "name": "Swap"
    }
  },
  "version": "1.0.0",
  "xdrEntries": [
    "AAAAAQAAAAAAAAAAAAAABFN3YXAAAAADAAAAAAAAAAxuZXdfYmFja3N0b3AAAAATAAAAAAAAABJuZXdfYmFja3N0b3BfdG9rZW4AAAAAABMAAAAAAAAAC3VubG9ja190aW1lAAAAAAY=",
    "AAAAAAAAAAAAAAAKaW5pdGlhbGl6ZQAAAAAAAwAAAAAAAAAKYmxuZF90b2tlbgAAAAAAEwAAAAAAAAAIYmFja3N0b3AAAAATAAAAAAAAAA5iYWNrc3RvcF90b2tlbgAAAAAAEwAAAAA=",
    "AAAAAAAAAAAAAAAKZGlzdHJpYnV0ZQAAAAAAAAAAAAEAAAAL",
    "AAAAAAAAAAAAAAAPZ2V0X2xhc3RfZGlzdHJvAAAAAAEAAAAAAAAAC2JhY2tzdG9wX2lkAAAAABMAAAABAAAABg==",
    "AAAAAAAAAAAAAAAMZ2V0X2JhY2tzdG9wAAAAAAAAAAEAAAAT",
    "AAAAAAAAAAAAAAATcXVldWVfc3dhcF9iYWNrc3RvcAAAAAACAAAAAAAAAAxuZXdfYmFja3N0b3AAAAATAAAAAAAAABJuZXdfYmFja3N0b3BfdG9rZW4AAAAAABMAAAAA",
    "AAAAAAAAAAAAAAAPZ2V0X3F1ZXVlZF9zd2FwAAAAAAAAAAABAAAD6AAAB9AAAAAEU3dhcA==",
    "AAAAAAAAAAAAAAAUY2FuY2VsX3N3YXBfYmFja3N0b3AAAAAAAAAAAA==",
    "AAAAAAAAAAAAAAANc3dhcF9iYWNrc3RvcAAAAAAAAAAAAAAA",
    "AAAAAAAAAAAAAAAEZHJvcAAAAAEAAAAAAAAABGxpc3QAAAPqAAAD7QAAAAIAAAATAAAACwAAAAA=",
    "AAAABAAAAJ9FcnJvciBjb2RlcyBmb3IgdGhlIGVtaXR0ZXIgY29udHJhY3QuIENvbW1vbiBlcnJvcnMgYXJlIGNvZGVzIHRoYXQgbWF0Y2ggdXAgd2l0aCB0aGUgYnVpbHQtaW4KY29udHJhY3RzIGVycm9yIHJlcG9ydGluZy4gRW1pdHRlciBzcGVjaWZpYyBlcnJvcnMgc3RhcnQgYXQgMTEwMC4AAAAAAAAAAAxFbWl0dGVyRXJyb3IAAAAJAAAAAAAAAA1JbnRlcm5hbEVycm9yAAAAAAAAAQAAAAAAAAAXQWxyZWFkeUluaXRpYWxpemVkRXJyb3IAAAAAAwAAAAAAAAARVW5hdXRob3JpemVkRXJyb3IAAAAAAAAEAAAAAAAAABhJbnN1ZmZpY2llbnRCYWNrc3RvcFNpemUAAARMAAAAAAAAAAdCYWREcm9wAAAABE0AAAAAAAAADVN3YXBOb3RRdWV1ZWQAAAAAAAROAAAAAAAAABFTd2FwQWxyZWFkeUV4aXN0cwAAAAAABE8AAAAAAAAAD1N3YXBOb3RVbmxvY2tlZAAAAARQAAAAAAAAABRTd2FwQ2Fubm90QmVDYW5jZWxlZAAABFE=",
    "AAAAAgAAAAAAAAAAAAAADkVtaXR0ZXJEYXRhS2V5AAAAAAACAAAAAQAAAAAAAAAKTGFzdERpc3RybwAAAAAAAQAAABMAAAABAAAAAAAAAAdEcm9wcGVkAAAAAAEAAAAT"
  ]
}
