{
  "contractId": "CDSYOAVXFY7SM5S64IZPPPYB4GVGGLMQVFREPSQQEZVIWXX5R23G4QSU",
  "description": "Blend v2 pool factory: deploys new Blend lending pools on Stellar mainnet.",
  "events": [],
  "functions": [
    {
      "doc": "Construct the pool factory contract\n\n### Arguments\n* `pool_init_meta` - The pool initialization metadata",
      "name": "__constructor",
      "params": [{ "name": "pool_init_meta", "type": { "name": "PoolInitMeta", "type": "named" } }],
      "returns": "void"
    },
    {
      "name": "deploy",
      "params": [
        { "name": "admin", "type": "address" },
        { "name": "name", "type": "string" },
        { "name": "salt", "type": { "size": 32, "type": "bytes_n" } },
        { "name": "oracle", "type": "address" },
        { "name": "backstop_take_rate", "type": "u32" },
        { "name": "max_positions", "type": "u32" },
        { "name": "min_collateral", "type": "i128" }
      ],
      "returns": "address"
    },
    {
      "name": "is_pool",
      "params": [{ "name": "pool_address", "type": "address" }],
      "returns": "bool"
    }
  ],
  "name": "Blend Pool Factory",
  "network": "mainnet",
  "types": {
    "PoolFactoryDataKey": {
      "cases": [{ "fields": [{ "name": "_0", "type": "address" }], "name": "Contracts" }],
      "kind": "union",
      "name": "PoolFactoryDataKey"
    },
    "PoolFactoryError": {
      "doc": "Error codes for the pool factory contract. Common errors are codes that match up with the built-in\ncontracts error reporting. Pool factory specific errors start at 1300.",
      "kind": "enum",
      "name": "PoolFactoryError",
      "variants": [
        { "discriminant": 1, "name": "InternalError" },
        { "discriminant": 3, "name": "AlreadyInitializedError" },
        { "discriminant": 1300, "name": "InvalidPoolInitArgs" }
      ]
    },
    "PoolInitMeta": {
      "fields": [
        { "name": "backstop", "type": "address" },
        { "name": "blnd_id", "type": "address" },
        { "name": "pool_hash", "type": { "size": 32, "type": "bytes_n" } }
      ],
      "kind": "struct",
      "name": "PoolInitMeta"
    }
  },
  "version": "0.0.0",
  "xdrEntries": [
    "AAAABAAAAKlFcnJvciBjb2RlcyBmb3IgdGhlIHBvb2wgZmFjdG9yeSBjb250cmFjdC4gQ29tbW9uIGVycm9ycyBhcmUgY29kZXMgdGhhdCBtYXRjaCB1cCB3aXRoIHRoZSBidWlsdC1pbgpjb250cmFjdHMgZXJyb3IgcmVwb3J0aW5nLiBQb29sIGZhY3Rvcnkgc3BlY2lmaWMgZXJyb3JzIHN0YXJ0IGF0IDEzMDAuAAAAAAAAAAAAABBQb29sRmFjdG9yeUVycm9yAAAAAwAAAAAAAAANSW50ZXJuYWxFcnJvcgAAAAAAAAEAAAAAAAAAF0FscmVhZHlJbml0aWFsaXplZEVycm9yAAAAAAMAAAAAAAAAE0ludmFsaWRQb29sSW5pdEFyZ3MAAAAFFA==",
    "AAAAAAAAAGhDb25zdHJ1Y3QgdGhlIHBvb2wgZmFjdG9yeSBjb250cmFjdAoKIyMjIEFyZ3VtZW50cwoqIGBwb29sX2luaXRfbWV0YWAgLSBUaGUgcG9vbCBpbml0aWFsaXphdGlvbiBtZXRhZGF0YQAAAA1fX2NvbnN0cnVjdG9yAAAAAAAAAQAAAAAAAAAOcG9vbF9pbml0X21ldGEAAAAAB9AAAAAMUG9vbEluaXRNZXRhAAAAAA==",
    "AAAAAAAAAAAAAAAGZGVwbG95AAAAAAAHAAAAAAAAAAVhZG1pbgAAAAAAABMAAAAAAAAABG5hbWUAAAAQAAAAAAAAAARzYWx0AAAD7gAAACAAAAAAAAAABm9yYWNsZQAAAAAAEwAAAAAAAAASYmFja3N0b3BfdGFrZV9yYXRlAAAAAAAEAAAAAAAAAA1tYXhfcG9zaXRpb25zAAAAAAAABAAAAAAAAAAObWluX2NvbGxhdGVyYWwAAAAAAAsAAAABAAAAEw==",
    "AAAAAAAAAAAAAAAHaXNfcG9vbAAAAAABAAAAAAAAAAxwb29sX2FkZHJlc3MAAAATAAAAAQAAAAE=",
    "AAAAAgAAAAAAAAAAAAAAElBvb2xGYWN0b3J5RGF0YUtleQAAAAAAAQAAAAEAAAAAAAAACUNvbnRyYWN0cwAAAAAAAAEAAAAT",
    "AAAAAQAAAAAAAAAAAAAADFBvb2xJbml0TWV0YQAAAAMAAAAAAAAACGJhY2tzdG9wAAAAEwAAAAAAAAAHYmxuZF9pZAAAAAATAAAAAAAAAAlwb29sX2hhc2gAAAAAAAPuAAAAIA=="
  ]
}
